[
  {
    "operations": "example-value",
    "granteePrincipal": "example-value",
    "retiringPrincipal": "example-value",
    "constraints": "example-value",
    "issuingAccount": "123456789012"
  },
  {
    "operations": "example-value",
    "granteePrincipal": "example-value",
    "retiringPrincipal": "example-value",
    "constraints": "example-value",
    "issuingAccount": "123456789012"
  }
]